{
  "$schema": "https://json-schema.org/draft/2020-12/schema",
  "$id": "https://github.com/haexmas/haex-hive/schemas/haex-hive.v2.schema.json",
  "title": "haex-hive Consumer Manifest v2",
  "description": "Schema for a consumer repository's .haex-hive.json v2 file. See spec-007 FR-001..FR-006.",
  "type": "object",
  "additionalProperties": false,
  "required": ["haex_hive_version", "identity", "atoms"],
  "properties": {
    "haex_hive_version": {
      "const": "2",
      "description": "Schema version. Must be the exact string \"2\"."
    },
    "haex_hive_min_version": {
      "$ref": "#/$defs/versionConstraint",
      "description": "Minimum CLI version required. Grammar: X.Y.Z or >=X.Y.Z. See FR-006."
    },
    "identity": {
      "$ref": "#/$defs/atomId",
      "description": "Consumer's own reverse-DNS project ID (D3)."
    },
    "atoms": {
      "type": "array",
      "items": { "$ref": "#/$defs/atomEntry" },
      "description": "The explicit allowlist of atoms this project inherits. Empty allowed."
    },
    "groups": {
      "type": "array",
      "items": { "type": "string" },
      "description": "v1 carry-over; not consumed by Spec 007 commands."
    },
    "active_feature": {
      "type": ["string", "null"],
      "description": "v1 carry-over."
    },
    "identity_note": {
      "type": "string",
      "description": "v1 carry-over free-text operator note."
    }
  },
  "$defs": {
    "atomId": {
      "type": "string",
      "pattern": "^[a-z0-9](?:[a-z0-9-]{0,61}[a-z0-9])?(?:\\.[a-z0-9](?:[a-z0-9-]{0,61}[a-z0-9])?)+$",
      "minLength": 3,
      "maxLength": 253,
      "description": "Reverse-DNS identifier per D3."
    },
    "versionConstraint": {
      "type": "string",
      "pattern": "^(?:>=)?(0|[1-9][0-9]*)\\.(0|[1-9][0-9]*)\\.(0|[1-9][0-9]*)$",
      "description": "Exact X.Y.Z or lower-bound >=X.Y.Z. See FR-006/R10."
    },
    "canonicalSourceUrl": {
      "type": "string",
      "pattern": "^(?!.*\\.git$)(?:https|ssh):\\/\\/[a-z0-9](?:[a-z0-9.-]*[a-z0-9])?(?::[0-9]+)?(?:\\/[A-Za-z0-9._~!$&'()*+,;=:%-]+)+$",
      "description": "Credential-free canonical https:// or ssh:// URL: lowercase host, non-empty path, no trailing slash, and no terminal .git. SCP-style and ssh transport-user inputs are normalized before storage."
    },
    "fullSha40": {
      "type": "string",
      "pattern": "^[0-9a-f]{40}$",
      "description": "Full 40-character lowercase git commit SHA."
    },
    "atomEntry": {
      "type": "object",
      "additionalProperties": false,
      "required": ["source", "revision", "includes"],
      "properties": {
        "source": { "$ref": "#/$defs/canonicalSourceUrl" },
        "revision": { "$ref": "#/$defs/fullSha40" },
        "track": {
          "type": "string",
          "minLength": 1,
          "description": "Optional non-authoritative branch annotation. Never overrides revision."
        },
        "includes": {
          "type": "array",
          "minItems": 1,
          "uniqueItems": true,
          "items": { "$ref": "#/$defs/atomId" }
        },
        "config": {
          "type": "object",
          "additionalProperties": { "$ref": "#/$defs/configEntry" },
          "propertyNames": { "$ref": "#/$defs/atomId" },
          "description": "Per-atom-id config overrides. Keys must be atom-ids resolved by this entry's includes."
        }
      }
    },
    "configEntry": {
      "type": "object",
      "additionalProperties": false,
      "properties": {
        "priority": {
          "type": "integer",
          "description": "Consumer-owned priority override (D5). Publisher config_schema MUST NOT declare a top-level priority property."
        },
        "values": {
          "type": "object",
          "description": "Deep-merged onto publisher defaults; validated against publisher config_schema after merge."
        }
      }
    }
  }
}
