{
  "haex_hive_version": "2",
  "haex_hive_min_version": ">=2.0.0",
  "identity": "com.github.example.project",
  "atoms": [
    {
      "source": "https://github.com/example/publisher",
      "revision": "0000000000000000000000000000000000000000",
      "includes": ["com.example.publisher.constitution"]
    }
  ]
}
